事件ID,事件名称,事件描述,结果1,奖励1,结果2,奖励2
int32,string,string,string,int32,string,int32
ID,Name,Describe,Result1,Reward1,Result2,Reward2
10001,街边乞丐,"路边有一乞丐，是否要施舍点银两。\n""大爷行行好…大爷行行好...""",给钱,2002,当没看到,
10002,小喽喽,"几个小喽喽挡住了你的去路。\n""嘿嘿…陪哥几个玩玩呗？""",求饶,2003,开干,2004
10003,西门龙,"西门龙正在调戏良家妇女，是否要上前帮忙？\n""嘿嘿嘿~~小妞陪大爷我玩玩~~""",出手,2004,胆怯离开,
10004,老酒鬼,"老酒鬼虽然穿的破破烂烂，但是隐隐有不凡的气度，说不定是隐士高人。\n""酒...此酒只应天上有...嗝..好酒..""",套个近乎（失去1瓶酒）,2005,又做白日梦了,
10005,美女,"一美女正在河中沐浴，河边的石头下压着她的衣衫，这真是千载难逢的好机会。\n""~~ 〆(???@) (((*&#xF""",偷偷拿走衣服,2006,我可是正经人,
